Category,Code,Title,Step,Filename
Quality,Q1A(R2),安定性試験法: 新有効成分含有医薬品,Step 5,000156844.pdf
Quality,Q1B,安定性試験法: 光安定性,Step 5,000156606.pdf
Quality,Q1C,安定性試験法: 新剤型及び一部変更,Step 5,000155987.pdf
Quality,Q1D,安定性試験法: ブラケッティング&マトリキシング,Step 5,000156354.pdf
Quality,Q1E,安定性試験法: 安定性データの評価,Step 5,000156086.pdf
Quality,Q2(R1),分析法バリデーション: 実施項目&実施方法,Step 5,000156368.pdf
Quality,Q2(R1),分析法バリデーション: 実施項目&実施方法,Step 5,000156432.pdf
Quality,Q2(R2),分析法バリデーションガイドラインの改正,Step 2a/2b,000265998.pdf
Quality,Q3A(R2),原薬の不純物,Step 5,000156108.pdf
Quality,Q3B(R2),製剤の不純物,Step 5,000156298.pdf
Quality,Q3C(R9),医薬品の残留溶媒の改正,Step 5,000156502.pdf
Quality,Q3D(R2),医薬品の元素不純物の改正,Step 5,000207677.pdf
Quality,Q4B,薬局方テキストのICH地域における相互利用,Step 5,000156021.pdf
Quality,Q5A(R1),バイオ医薬品の品質: ウィルスバリデーション,Step 5,000156380.pdf
Quality,Q5A(R2),ヒト又は動物細胞株を用いて製造されるバイオテクノロジー応用医薬品等のウイルス安全性評価,Step 2a/2b,000265997.pdf
Quality,Q5B,バイオ医薬品の品質: 遺伝的安定性,Step 5,000156706.pdf
Quality,Q5C,バイオ医薬品の品質: 製品の安定性,Step 5,000156460.pdf
Quality,Q5D,バイオ医薬品の品質: 細胞株管理（セルサブストレート）,Step 5,000156150.pdf
Quality,Q5E,バイオ医薬品の品質: 同等性比較,Step 5,000156276.pdf
Quality,Q6A,医薬品の規格及び試験方法（化学物質 / 3局方との調和を継続）,Step 5,000156301.pdf
Quality,Q6B,バイオ医薬品の規格及び試験方法,Step 5,000156781.pdf
Quality,Q7,原薬GMP,Step 5,000156438.pdf
Quality,Q8(R2),製剤開発,Step 5,000156605.pdf
Quality,Q9(R1),品質リスクマネジメントに関するガイドラインの改正,Step 5,000155974.pdf
Quality,Q10,医薬品品質システム,Step 5,000156141.pdf
Quality,Q11,原薬の開発と製造,Step 5,000156136.pdf
Quality,Q12,医薬品のライフサイクルマネジメント,Step 5,000243555.pdf
Quality,Q13,原薬及び製剤の連続生産,Step 5,000252834.pdf
Quality,Q14,分析法の開発,Step 2a/2b,000265999.pdf